{
  "schema_version": "0.1",
  "entry_id": "cv-20260703-er-uni-mlp",
  "created_at": "2026-07-03T09:00:00Z",
  "owner": "sjpark",
  "reviewer": "braveji",
  "endpoint": "er_status",
  "model": "SlideMLP",
  "embedding_model": "uni_v1",
  "embedding_dim": 1024,
  "train_dataset": "TCGA-BRCA",
  "test_dataset": "CPTAC-BRCA",
  "split_policy": "split_policy_v0 (site-disjoint train 707 / val 152 / test 151)",
  "n_train": 707,
  "n_val": 152,
  "n_test": 653,
  "internal_metrics": {"auc": null, "auprc": null, "balanced_accuracy": null, "n": 152},
  "external_metrics": {"auc": null, "auprc": null, "balanced_accuracy": null, "n": 653},
  "generalization_gap": {"auc_delta": null, "auprc_delta": null, "balanced_accuracy_delta": null},
  "baselines": {"random_auc": null, "subtype_only_auc": null, "pixel_mean_auc": null},
  "experiment_dir": "experiments/sjpark/20260703_er_uni_mlp_cptac/",
  "predictions_path": "experiments/sjpark/20260703_er_uni_mlp_cptac/predictions.npy",
  "critic_report_path": "experiments/sjpark/20260703_er_uni_mlp_cptac/critic_report.json",
  "commit_hash": "0000000",
  "critic_status": "pending",
  "claim_level": "hypothesis_only",
  "notes": "Template example — replace nulls with real metrics. Not a real result."
}
